,제목,링크,내용
27,"멈췄던 고리 2호기, 2년반 만에 재가동",https://n.news.naver.com/mnews/article/025/0003482611," 원자력안전위원회는 13일 전체회의를 열고 고리 원자력발전소 2호기 계속운전 허가를 의결했다. 사진은 이날 부산시 기장군의 한 포구에서 바라본 고리 2호기(왼쪽) 모습. 송봉근 객원기자 원자력안전위원회(이하 원안위)가 설계 수명 만료로 2년7개월째 가동이 중단된 부산 고리원자력발전소 2호기에 대한 계속운전을 세 번째 심의 만에 허가했다. 이번 결정으로 원전 사업자인 한국수력원자력(한수원)이 계속운전을 신청한 남은 9기 원전에 대한 계속운전 허가 가능성도 커졌다. 인공지능(AI) 인프라 구축의 필수 요소인 대규모 전력 공급이 이른 시일 내에 이뤄질 수 있게 됐다는 점에서 “한숨 돌렸다”는 평가도 나온다. 원안위는 13일 제224회 회의를 열고 고리 2호기 계속운전 허가 안건을 의결했다. 고리 2호기의 수명은 설계 수명 만료일(2023년 4월)로부터 10년 뒤인 2033년 4월까지로 연장됐다. 한수원은 설비 개선 등 준비 과정을 거쳐 내년 2월 고리 2호기 재가동에 들어갈 계획이다. 고리 2호기는 1983년 상업운전을 시작한 원전으로, 설비 용량은 685메가와트(㎿)다. 원안위는 9인 회의체지만, 최근 일부 위원들의 임기가 종료되면서 이날 회의에는 남은 6명 위원 전원이 참여했다. 회의에서는 과거 운영 허가 시점과 현재 시점 변화를 비교해야 계속운전의 적절성을 판단할 수 있다는 반대 의견(진재용 위원)도 나왔다. 하지만 최원호 원안위원장이 “과거 데이터가 향후 계속운전 영향 평가에 거의 의미가 없다”고 판단하면서 표결이 진행됐다. 그 결과 찬성 5인, 반대 1인으로 원안 의결됐다. 이날 회의에서는 현장 방청을 신청한 일부 환경단체 활동가들이 계속운전에 반대하며 소란을 피워 퇴장 조치를 당하기도 했다. 차준홍 기자 설계수명을 다한 원전의 계속운전이 허가된 건 이번에 세 번째다. 앞서 2007년과 2015년 계속운전이 허가된 고리 1호기와 월성 1호기는 문재인 정부의 탈원전 정책 영향으로 각각 2017년과 2019년 영구 정지됐다. 고리 2호기 역시 정책 영향으로 계속운전 신청 절차가 늦어졌다. 이 바람에 원안위 심의가 끝나기 전 설계수명 만료일이 도래해 가동이 중단됐다. 고리 2호기의 실질적인 추가 가동 기간은 앞으로 8년이 채 되지 않는다. 계속운전 기간은 원안위의 계속운전 허가 시점 기준이 아니라 설계수명 만료일로부터 10년이라서다. 재가동 시점은 늦춰졌지만, 원안위의 이번 결정은 계속운전을 신청한 남은 9기 원전의 수명 연장에 긍정적인 선례로 작용할 전망이다. 현재 고리 3·4호기도 설계수명이 만료돼 가동 중단 상태다. 정동욱 중앙대 에너지시스템공학부 교수는 “AI 인프라 확충에 필요한 에너지 수요를 감당하고 2035년 국가 온실가스 감축 목표(NDC)를 달성하기 위해선 안전성이 담보된 기존 원전의 수명을 늘리는 방법이 효과적”이라며 “남은 9기 원전에 대한 수명 연장에도 청신호가 켜졌다”고 말했다. ━ “원전 없인 AI 경쟁력 확보 어렵다”…남은 9기 연장이 관건 한국은 최근 엔비디아로부터 AI의 두뇌 격인 최신형 그래픽처리장치(GPU) 26만 장을 우선 공급받기로 했지만, 한편에선 이를 가동할 전력 공급 우려도 커졌다. 원안위는 이런 상황에서도 수명을 늘려 쓸 수 있는 원전의 계속운전 승인을 차일피일 미뤘다. 그 때문에 산업계 안팎에선 재생 에너지를 최우선으로 확대하면서도 기존 원전은 수명을 연장하겠다는 이재명 정부의 ‘원전 실용주의’에 대한 진정성에 의구심을 제기하는 목소리도 있었다. 하지만 이번 결정으로 AI 시대를 대비한 전력 확보라는 큰 산을 넘었다는 평가가 나온다. 초대형 AI 데이터센터 1기를 운영하기 위해 필요한 전력 용량은 500㎿ 안팎이다. 한국이 공급받기로 한 GPU 26만 장으로 데이터센터를 구축할 경우 감당해야 할 전력 용량은 약 500~600㎿로 추정된다. 고리 2호기의 설비 용량이 685㎿라는 점을 고려하면 전력 병목 현상을 가장 빠르게 해소할 수 있는 수단인 셈이다. 정용훈 KAIST 원자력양자공학과 교수는 “GPU 26만 장을 돌리기 위해선 최소 260㎿ 규모 전력 용량이 필요하고, 여기에 데이터센터 냉각에 필요한 전력까지 고려하면 500㎿ 이상 전력을 확충해야 한다”며 “관건은 향후 5년 안에 대규모 전력을 확보해야 한다는 것인데, 기존 원전의 수명을 연장하는 것이 가장 빠르고 경제적”이라고 말했다. 해외에선 안전성이 담보된 원전의 수명을 적극적으로 연장하고 있다. 미국의 경우 운영 허가 기간이 만료된 원전의 계속운전 승인율은 100%에 달한다. 심지어 지난해 9월 마이크로소프트(MS)는 영구 정지된 원전을 다시 사용하는 계약을 맺기도 했다. 스위스의 경우도 안전성 평가를 통과한 원전의 경우 무기한으로 운전을 허용하고 있다. 전 세계에서 가장 오래된 원전인 베스나우 원전(1969년 상업운전 시작)이 아직도 스위스에서 가동되고 있는 이유다. 문주현 단국대 에너지공학과 교수는 “AI 산업을 키워 국가 경쟁력을 높이겠다는 목표는 경제성과 안전성을 갖춘 원전을 배제한 상태에선 달성하기 힘들다”며 “미국 등에선 40년 이상 가동한 원전도 많고, 노후 원전이라도 계속승인 이후 최신 안전설비로 교체하는 작업을 진행하기 때문에 안전성은 크게 걱정할 필요가 없다”고 주장했다. "
28,"고리 원전 2호기, 2033년까지 연장",https://n.news.naver.com/mnews/article/023/0003940916,"정지 2년반 만에 재가동 승인‘AI 시대’ 위해 전력 확보 필수최초 운영 허가 기간 40년이 지나 2년 7개월째 멈춰 선 고리 원자력발전소 2호기 운영 기간이 2033년 4월로 10년 연장됐다.원자력안전위원회는 13일 회의에서 ‘고리 2호기 계속운전 허가안’을 표결에 부쳐 찬성 5인, 반대 1인으로 통과시켰다. 앞서 원안위는 지난 9월과 10월 두 차례 심의에서 의결을 보류했다가 세 번째로 심의한 이날 회의에서 허가안을 의결했다. 원자력 업계에서는 이번 결정이 큰 틀에서 이재명 정부의 에너지 정책 기조와 맞닿아 있는 것으로 평가한다. AI(인공지능) 세계 3대 강국을 목표로 내세운 정부가 데이터센터 확충 등으로 급증할 전력 수요를 감당하기 위해선 기존 원전의 운영 연장은 필수라고 판단했다는 것이다. 다음 달 운영 기간이 끝나 가동이 멈추는 한빛 1호기를 포함해 계속 운전 신청을 낸 원전 9기 재가동 허가도 탄력이 붙을 것으로 예상된다.하지만 원전업계에선 원전 운영 연장을 위한 심사 기간을 대폭 단축하고, 신규 원전 건설도 속도를 내야 한다고 지적한다. 고리 2호기의 경우, 한국수력원자력이 2022년 4월 운영 연장 신청을 했는데, 3년 반 만에 허가가 나왔다. 연장 기간도 가동을 멈춘 2023년 4월부터 계산하기 때문에 이날 10년 연장 결정에도 7년 5개월만 더 쓸 수 있다. 가동 중단한 2년 7개월은 고스란히 손실로 남게 됐다. 원전 업계는 이 기간 원전보다 비용이 비싼 LNG(액화천연가스)를 수입해 전력을 생산한 점을 감안하면 손실이 1조원 이상일 것으로 추산한다. 문주현 단국대 에너지공학과 교수는 “현재 10년인 운영 연장 기간도 미국처럼 20년으로 늘려야 한다”며 “원전 생태계 유지와 전력 수요를 충족하기 위해선 신규 원전 건설도 반드시 필요하다”고 했다.고리 2호 삼수 끝 ‘계속 운전’… “AI 시대, 다른 9기 심의 서둘러야”국내에서 40년 운영 기간이 다한 원전에 대해 추가 운영 허가가 난 건 2008년 고리 1호기, 2015년 월성 1호기에 이어 고리 2호기가 세 번째다. 이재명 정부 출범 이후 처음으로 원전 계속 운전을 승인한 사례이기도 하다. 원전 정책에 대해 모호한 입장을 보였던 이재명 정부에서 고리 2호기에 대한 계속 운전 승인이 난 데 대해 원자력 업계에선 현 정부의 에너지 정책이 문재인 정부 때 ‘탈(脫)원전’ 그림자에서 벗어나 ‘실용적 에너지 믹스’로 선회했다는 평가가 나온다.그래픽=박상훈부산 기장군에 있는 고리 2호기는 가압 경수로 방식의 출력 685메가와트(MW)급 원전으로 1983년 4월 9일 상업 운전을 시작했다. 설계 당시 허가 기간(40년)이 다해 2023년 4월 8일 가동이 중단됐다. 13일 원안위 승인으로 고리 2호기는 곧바로 재가동 준비 절차에 들어간다. 현재 진행 중인 설비 개선을 끝내고 정기 검사로 안전성을 확인한 뒤 내년 2월 발전을 재개한다는 계획이다. 한수원은 “고리 2호기 재가동은 AI, 데이터센터 등 미래 전력 수요 증가에 대한 안정적인 에너지 공급원으로서 국가 경제에 이바지할 것”이라고 밝혔다.◇심의 기간 단축하고 연장 기간 늘려야고리 2호기를 포함해 가동 연한을 늘려달라고 원안위에 신청한 원전은 10기에 달한다. 이 원전의 발전 용량은 8.45기가와트(GW)로 전체 원전 발전 용량(26.05GW)의 3분의 1에 해당한다. 이번처럼 원전 계속 운전 심의 기간이 길어져 가동이 중단되면, AI 시대 폭증하는 전력 수요에 대응하기 어렵다는 지적이 나오는 이유다.특히 정부가 AI 3대 강국을 공언한 상황에서 AI의 생명줄과 다름없는 전력 생산에 원전은 필수다. 엔비디아가 한국에 우선 공급하기로 한 GPU(그래픽처리장치) 26만장을 안정적으로 가동하기 위해서는 냉각과 인프라까지 포함해 최대 1GW(기가와트) 전력이 필요하다. 이는 고리 2호기의 1.5배에 육박하는 수준이다. 여기에 국가온실가스 감축목표(NDC)도 이루려면 기존 원전 운영을 중단하면 안 되는 상황이다.원안위는 현재 운영 허가 기간이 끝나 가동이 중단된 고리 3·4호기에 대한 심의는 내년 상반기 끝낸다는 계획이다. 같은 이유로 다음 달 멈춰서는 한빛 1호기는 내년 하반기 심의를 마친다는 목표다. 한울 1·2호기는 2027년 상반기에, 월성 2·3·4호기는 2027년 하반기에 재가동 허가 여부를 결정할 예정이다. 원안위가 올해 국정감사 업무보고에 밝힌 대로 심의가 진행될 경우, 한울 1·2호기와 월성 3·4호기는 가동 연한이 끝나기 전에 연장 허가를 받게 돼 발전이 중단되지 않는다.앞서 고리 2호기는 문재인 정부의 탈원전 정책 탓에 운영 연장 신청이 늦어지면서 2년 넘게 가동을 멈춰야 했다. 정재학 경희대 원자력공학과 교수는 “원전을 새로 지으려면 수조 원씩 드는데, 가동 연한이 끝났다고 기존 원전을 멈춰 세우는 것만큼 낭비도 없다”며 “이재명 정부는 전력 문제에는 정치적 입장을 떠나 실용주의적 노선을 택하고 있다는 것이 이번 재가동 허가에 반영된 것으로 판단된다”고 했다.◇“기존 원전 안전성도 신규 원전이 뒷받침”현재 원전 기술력 등을 감안할 때 10년 주기인 운영 연장 기간을 20년 이상으로 늘려야 한다는 지적이 나온다. 미국은 원전 92기 중 84기(약 90%)가 기존 40년 수명에 20년 추가로 운영을 허가받았다. 특히 버지니아에 있는 서리(Surry) 1호기는 1972년 상업운전을 시작했는데 두 차례 운영 기간이 연장돼 현재는 2052년까지 가동이 가능하다. 전체 운영 기간이 80년이다. 미국은 지난해 ‘2050 원자력 확대 로드맵’을 통해 최대 80년인 원전 운영 기간을 100년까지 늘리는 방안도 제시했다. 후쿠시마 원전 사고를 겪은 일본도 일부 원전은 40년에서 20년을 연장해 최대 60년까지 운전할 수 있게 됐다. 프랑스도 60년까지 연장이 가능하고, 스웨덴도 지난해 60년에서 80년으로 연장하겠다는 방향을 발표했다. 국제원자력기구에 따르면, 전 세계 원전 416기 중 189기(45%)가 40년 이상 가동 중이다. 전문가들은 고리 2호기를 비롯해 국내 원전도 80년 이상 무난하게 쓸 수 있는 것으로 분석한다. 최성민 KAIST 원자력 및 양자공학과 교수는 “AI 인프라 확충에 필요한 에너지 수요를 감당하기 위해서라도 다른 나라처럼 연장 허가 기간을 20년씩 늘리는 방안을 적극적으로 검토해야 한다”고 했다.한편 이날 원안위 결정에 대해 환경 단체는 반발했다. 에너지정의행동은 성명을 내고 “국민 안전을 포기한 결정이며 절차적 위법에도 강행한 위헌적 결정”이라며 승인 철회를 요구했다. 이들은 “출범 초기부터 핵발전 안전 강화를 강조해온 정부가 실용이라는 단어 뒤에 숨어 비민주적이고 위험한 수명 연장 절차를 묵인했다”며 “이재명 정부는 고리 2호기를 비롯한 모든 노후 핵발전소 영구 정지를 결정하라”고 밝혔다."
29,"전략 바꾼 국내 게임사, 현질 버리고 흥행 검증된 IP 꺼냈다",https://n.news.naver.com/mnews/article/025/0003482555," ━ 지스타 2025 부산서 개막 국내 최대 글로벌 게임전시 ‘지스타 2025’가 13일 부산 벡스코에서 개막했다. 관람객들이 넷마블 시연 부스에서 게임을 즐기고 있다. 송봉근 객원기자 ‘착한’ 게임을 만들고, ‘아는 맛’을 꺼내들었다. 13일 부산 벡스코(BEXCO)에서 열린 국내 최대 게임 전시회 ‘지스타(G-STAR) 2025’에선 국내 게임사들의 이같은 전략 변화 모습이 두드러졌다. 막대한 돈을 쓰는 소수 게이머보다 적게 써도 수가 많은 일반 게이머에 더 집중하고, 대신 흥행력이 검증된 기존의 IP(지식재산권)를 다양한 장르 게임으로 변주해 안정적인 수익 모델을 모색하는 식이다. 엔씨소프트 ‘아이온2’ 시연존에는 100m이상 긴 대기 줄이 늘어섰다. [사진 엔씨소프트] 이번 지스타 메인 스폰서로 참여한 엔씨소프트가 대표적이다. 오는 19일 정식 출시 예정인 게임 ‘아이온2’ 대규모 시연 부스를 설치한 엔씨는 아이온2 과금 구조를 기존 리니지M 등과 달리 배틀패스(월정액 상품)와 스킨(캐릭터 치장)으로 구성했다. 엔씨 부스엔 아이온2를 시연해 보려는 사람들이 몰리면서 대기 시간이 2시간 이상을 넘기기도 했다. 엔씨는 이날 소니 인터랙티브 엔터테인먼트(소니)와 협업 사실도 공개했다. 소니의 유명 IP인 호라이즌 시리즈를 다중접속역할수행게임(MMORPG)로 재해석한 게임이다. 이성구 호라이즌 스틸러스 프론티어스 총괄 프로듀서는 게임 과금 구조에 대해서도 “(멤버십과 스킨 위주의) 아이온2와 같은 착한 비즈니스 모델(BM) 결을 가져갈 계획”이라고 말했다. 크래프톤은 ‘팰월드 모바일’을 첫 공개했다. 김민정 기자 과금을 대신해 게임사들이 선택한 건 꾸준히 인기를 끄는 IP(지적재산권) 활용이다. 오랫동안 사랑받아왔거나 흥행성과가 검증된 IP를 활용해 새로운 이용자층을 확보한다는 전략이다. 넷마블은 이날 출품한 5개 게임 가운데 3개 게임이 원작 IP가 따로 있는 게임이었다. 웹소설 ‘나 혼자만 레벨업’(나혼렙) IP를 활용한 ‘나혼렙: 카르마’, 만화·애니메이션 ‘일곱 개의 대죄’ IP를 활용한 ‘일곱 개의 대죄: 오리진’, 2013년 출시된 원작 게임 ‘몬스터 길들이기’의 후속작인 ‘몬길: 스타 다이브’ 등이다. 크래프톤의 출품작 ‘팰월드 모바일’도 일본에서 만든 글로벌 히트 게임 ‘팰월드’를 모바일 재해석해 만든 게임이다. 업계가 대형 IP 신작에 공을 들이는 이유는 원작 팬을 새로운 이용자 층으로 끌어들일 수 있기 때문이다. 지스타 현장에서 기자들과 만난 권도형 넷마블네오 총괄 PD는 나 혼자만 레벨업 IP에 대해 “아직도 애니메이션 방영이 지속되고 있는 성장하는 IP”라며 “게임 외 장르에서 흥행하는 IP와 협업해 팬들에게 다가가려 하고 있다”고 말했다. 오는 16일까지 열리는 이번 지스타에는 총 44개 국가에서 1273개 회사가 참여했다. "
30,"""엄마, 나만 빼고 다 있어""…역대급 돌풍에 없어서 못 판다는 '이것', 뭐길래?",https://n.news.naver.com/mnews/article/011/0004555681,"AP연합뉴스[서울경제] 닌텐도의 최신 콘솔 게임기 '스위치2'가 역대 최고가 책정에도 불구하고 예상을 뛰어넘는 판매 실적을 거두며 게임업계의 주목을 받고 있다. 닌텐도는 물론 국내 총판을 맡은 신세계아이앤씨, 핵심 반도체를 공급하는 삼성전자까지 수혜를 입으며 콘솔 게임 시장의 부활을 알리고 있다.12일 IT업계에 따르면 지난 6월 출시된 닌텐도 스위치2는 9월까지 전 세계에서 1036만대가 판매됐다. 국내 판매가는 단품 64만8000원, '마리오카트 월드' 동봉 세트는 68만8000원으로 닌텐도 게임기 역사상 최고가지만 흥행 가도를 달리고 있다. 일본 내수용 가격 4만9980엔(약 47만원)과 비교하면 국내 소비자는 20만원가량 더 지불하는 셈이다.출시 초기 품귀 현상은 지금까지 이어지고 있다. 6월 한국과 미국에서 품절 사태가 벌어졌고 중고거래 플랫폼에서는 프리미엄 가격에 거래되는 사례가 속출했다. 일본에서는 사전 예약에만 220만명이 몰렸으며 출시 4개월이 지난 현재도 구매 대기 상태가 지속되고 있다. 후루카와 슌타로 닌텐도 사장은 ""해외는 적정 재고를 확보했으나 일본 내에서는 원하는 시기에 구매할 수 있는 상황이 아니다""라며 ""스위치2가 기대 이상의 출발을 보였다""고 밝혔다.닌텐도는 당초 내년 3월까지 1500만대 판매를 전망했으나 최근 1900만대로 목표를 상향 조정했다. 연말 크리스마스 시즌 수요를 감안하면 올해 매출은 전년 대비 93% 증가한 2조2500억엔(약 21조3000억원)에 달할 것으로 예측된다. 이는 닌텐도 역대 최대 매출 기록이다.신세계아이앤씨는 스위치2 판매 호조로 지난 3분기 IT 유통 매출 432억원을 기록하며 전년 동기 대비 8.5% 성장했다. 4분기 크리스마스 특수까지 더해지면 매출 증가세는 당분간 지속될 전망이다.삼성전자는 스위치2의 핵심 반도체인 엔비디아 설계 시스템온칩(SoC) '테그라'를 8나노 공정으로 생산하며 수혜를 받고 있다. 전작 스위치에서 대만 TSMC가 담당했던 물량이 이번에는 삼성전자로 넘어왔다. 콘솔 게임기에는 메모리를 포함한 다수의 반도체 부품이 들어가며, 그간 반도체 업계에서 주목하지 않았던 콘솔 시장이 새로운 수요처로 급부상하고 있다. 시장조사업체 GMI는 글로벌 게임 콘솔 시장 규모가 지난해 55억8000만달러를 기록했으며, 2025년부터 2034년까지 연평균 5% 이상 성장할 것으로 내다봤다."
31,"퀄컴, 차세대 산업용 프로세서 '드래곤윙 IQ-X' 공개",https://n.news.naver.com/mnews/article/092/0002398366,"산업용 PLC, 엣지 컨트롤러, 박스 PC 위해 견고성 강화퀄컴이 13일 자체 개발 Arm 호환 오라이온 CPU 기반 차세대 산업용 프로세서 '드래곤윙 IQ-X'를 공개했다.드래곤윙 IQ-X 시리즈는 프로그래머블 로직 컨트롤러(PLC), 고급 인간-머신 인터페이스(HMI), 엣지 컨트롤러, 패널 PC, 박스 PC 등 산업 현장의 다양한 기기를 위해 설계됐다.TSMC 4나노급 공정에서 생산된 퀄컴 오라이온 CPU는 8코어에서 12코어까지 선택 가능하며 최대 45 TOPS(1초당 1조 번 연산) AI 연산이 가능한 헥사곤 NPU를 내장했다.퀄컴 드래곤윙 IQ-X 개발키트 시제품. (사진=지디넷코리아)윈도11 IoT 엔터프라이즈 LTSC 기반으로 Qt, 코드시스, 이더캣 등 산업 현장에 널리 쓰이는 소프트웨어, 미들웨어와 응용프로그램, 개발 도구를 폭넓게 지원한다.산업용 PC에 요구되는 영하 40도에서 105도 사이 작동을 지원하며 산업 표준 COM 모듈 폼팩터를 지원해 기존 캐리어 보드에 드롭인 방식으로 쉽게 교체할 수 있다.드래곤윙 IQ-X 탑재 산업용 기기는 퀄컴 AI 소프트웨어 스택과 ONNX, 파이토치 등 런타임을 활용해 오라이온 CPU와 헥사곤 NPU의 AI 연산 성능을 활용한 다양한 엣지 AI 응용프로그램을 구동할 수 있다.드래곤윙 IQ-X는 45 TOPS급 NPU로 스마트 팩토리 등 엣지 AI 기반 자동화를 실현한다. (사진=퀄컴)나쿨 두갈 퀄컴 오토모티브, 산업 및 임베디드 IoT 부문 본부장은 ""드래곤윙 IQ-X 시리즈는 오라이온 CPU의 우수한 성능을 산업용 PC에 도입해 더욱 고도화된 스마트 팩토리와 강력하고 고성능의 엣지 컨트롤러 구현을 실현한다""고 설명했다.이어 ""드래곤윙 IQ-X 시리즈는 OEM과 ODM이 복잡성을 줄이고 시장 출시 기간을 단축하며, 향후 수 년간 경쟁력 있는 산업용 솔루션을 개발할 수 있는 토대를 제공한다""고 부연했다.어드밴텍, 콩가텍, 콘트론, 넥스컴, 포트웰, 세코, 트리아 등 주요 글로벌 장비 제조사가 드래곤윙 IQ-X 시리즈 플랫폼을 채택했고 이를 탑재한 상용 기기는 향후 몇 개월 안에 공개 예정이다."
32,"고리 2호기, 두 차례 보류 끝에 '수명 연장' 결정",https://n.news.naver.com/mnews/article/052/0002272882,"2023년 '40년 설계수명' 종료로 원자로 가동 정지원안위, 계속운전' 위한 안전성 등 검토계속운전 여부 두 차례 연기되면서 의구심 키워[앵커] 원자력안전위원회가 두 차례나 심의를 보류했던 고리 원전 2호기의 수명을 연장하기로 했습니다.오는 2033년까지 가동될 예정인데, 설계 수명이 다한 다른 원전들의 가동 여부에도 관심이 쏠리고 있습니다.임늘솔 기자가 보도합니다.[기자] 지난 2023년 40년 설계수명이 종료되면서 원자로 가동이 정지된 고리 2호기.이후 원자력안전위원회는 '계속운전'을 위한 안전성과 향후 이행 계획에 대한 검토에 들어갔습니다.하지만 당초 지난 9월에 결론이 나야할 '계속운전' 안건은 두 차례나 연기되면서 재가동 여부에 대한 의구심을 키웠습니다.[진재용/ 원자력안전위원회 비상임위원 : 9월과 10월 회의에서는 3건의 신규 고시 제정, 사고 관리 계획서 승인 등 다른 중요한 안건과 같이 심의가 진행되었기 때문에 계속 운전 허가에 대한 심의에 투입할 수 있는 시간 자체가 적었습니다.] 원안위는 우여곡절 끝에 이번 회의에서 '계속운전'을 승인하면서 가동 정지 2년 반 만에 연장 운행이 결정됐습니다.이에 따라 고리 2호기는 오는 2033년까지 가동될 예정입니다.전문가들은 고리 2호기의 안전성에 문제가 없고, 경제적인 측면에서도 신규로 원전을 건설하는 것보다 낫다는 입장입니다.[정범진 / 경희대 원자력공학과 교수 : 고리 2호기는 동일한 발전소가 외국에서 돌아가고 있고요. '계속운전'도 하고 있고, 안전성 차원에서 기술적으로 계속 운전을 안 할 이유가 없는 것이고요. 감가상각이 다 끝난 발전소에서 전기를 생산할 수 있다는 것은 국민에게는 더 싼 값으로 전기를 공급할 수 있는 것이니까 바람직한 일이고요.]하지만 노후 원전은 정밀 점검과 보수를 위한 비용이 증가하고 사고 위험도 더 크다는 반대의 목소리도 여전합니다.원안위는 앞서 지난 6월에는 2017년부터 영구정지된 고리 1호기에 대해 해체를 승인했습니다.이번 결정은 한수원이 10개 원전에 대해 신청한 계속운전 심사의 첫 사례로, 고리 3호기와 4호기 등 다른 원전에 대한 심사 결과도 주목됩니다.YTN 사이언스 임늘솔 입니다.영상편집 : 황유민※ '당신의 제보가 뉴스가 됩니다'[카카오톡] YTN 검색해 채널 추가[전화] 02-398-8585[메일] social@ytn.co.kr"
